market_type,band_low,band_high,side,extra_juice_pct,notes
moneyline,0.00,0.30,any,0.026,Heavy longshots materially underperform implied probability.
moneyline,0.30,0.40,any,0.026,Low-probability underdogs consistently overpriced.
moneyline,0.40,0.50,any,0.024,Near-coinflip dogs still bleed vs implied odds.
moneyline,0.50,0.60,any,0.020,Small favorites slightly overpriced.
moneyline,0.60,0.70,any,0.008,Pricing tightens; mild favorite tax remains.
moneyline,0.70,0.80,any,0.015,Public preference inflates mid-to-high favorites.
moneyline,0.80,1.00,any,0.008,Heavy favorites still overpriced but books defend better.
